{
  "benchmark_matter_id": "M009",
  "run_id": "statutory-qa-v1",
  "produced_by": {
    "research_agent": "researcher-M009",
    "research_model": "claude-opus-5 (Claude Code subagent)",
    "research_completed": "2026-09-04T22:10:00Z",
    "verification_agent": null,
    "verification_model": null,
    "verification_completed": null
  },
  "matter_reference_date": "2026-04",
  "matter_reference_date_basis": "exam_session APRIL 2026 as recorded in candidates/matters/M009.json; the scenario events are dated January 2026, which is earlier, so the same body of law applies on either date.",
  "corpus_gaps": [
    "Registration of Title Act s.45(1)(a): the numeral fixing the forwarding period is missing from the extracted body ('by the Attestor working days of such attestation'). The same gap is present in the source JSON at data/legal-sources/library/finalized/21-1998-registration-of-title-act/21-1998-registration-of-title-act.json. Only the section heading ('within seven days') carries the number. Needs re-extraction from a Government Printer edition.",
    "Registration of Title Act s.75: the run-on rendering of the interpretation section has dropped the defined terms themselves, leaving only the 'means ...' clauses, so a definition can be matched to its term only through the corpus defined_terms list and the order of the clauses.",
    "The 'prescribed penalty' for the offence in s.45(1)(b) sits in regulations made under s.67; no Registration of Title regulations are in the corpus, so the amount of the penalty cannot be stated.",
    "The corpus edition of the Registration of Title Act is flagged 'original_or_unconfirmed_consolidation' from a private republisher, so any amendment to the Act made after 1998 would not show in the section metadata."
  ],
  "provisions": [
    {
      "provision_id": "PROV-M009-001",
      "section_id": "21-1998/s45",
      "act_id": "21-1998",
      "formal_title": "Registration of Title Act No. 21 of 1998",
      "number_and_year": "No. 21 of 1998",
      "section": "45",
      "subsection": "1(a)",
      "relevant_excerpt": "Any instrument attested in terms of section 44 together with the Certificate of Title pertaining to the title of the vendor shall be forwarded by the Attestor working days of such attestation to the Registrar of Title within whose area of jurisdiction the land parcel dealt with in such instrument is situate.",
      "why_relevant": "This is the provision that fixes the period within which an attesting notary must forward an attested instrument, with the vendor's Certificate of Title, to the Registrar of Title. It answers the second limb of the question. The corpus body is defective: the numeral before 'working days' is missing from the extracted text, so the period is recoverable only from the section heading in the corpus record, 'Attestor to forward instruments attested within seven days.'",
      "applicable_to_matter_date": true,
      "temporal_note": "in_force_from_year 1998, no amendment_events recorded for this section; in force at 2026-04. The gap in the extracted text is an extraction defect, not an amendment.",
      "verification_status": "proposed",
      "verifier_note": "Re-extract section 45(1)(a) from a Government Printer edition and confirm the missing numeral before 'working days' before this question can be released as gold."
    },
    {
      "provision_id": "PROV-M009-002",
      "section_id": "21-1998/s45",
      "act_id": "21-1998",
      "formal_title": "Registration of Title Act No. 21 of 1998",
      "number_and_year": "No. 21 of 1998",
      "section": "45",
      "subsection": "1(b)",
      "relevant_excerpt": "Failure to forward the attested instrument within the stipulated period shall be an offence punishable with the prescribed penalty.",
      "why_relevant": "Makes the forwarding duty in subsection (1)(a) mandatory rather than directory, and is the provision under which the notary's default is penalised.",
      "applicable_to_matter_date": true,
      "temporal_note": "in_force_from_year 1998, no amendment_events recorded; in force at 2026-04. The 'prescribed penalty' depends on regulations made under section 67, which are not in the corpus.",
      "verification_status": "proposed",
      "verifier_note": null
    },
    {
      "provision_id": "PROV-M009-003",
      "section_id": "21-1998/s38",
      "act_id": "21-1998",
      "formal_title": "Registration of Title Act No. 21 of 1998",
      "number_and_year": "No. 21 of 1998",
      "section": "38",
      "subsection": null,
      "relevant_excerpt": "No person acquiring an interest in any land parcel registered under the provisions of this Act shall be entitled to such title or interest unless such title or interest is registered under the provisions of this Act.",
      "why_relevant": "First limb of the question: registration is not optional. A donee of a registered land parcel gets no title unless the interest is registered.",
      "applicable_to_matter_date": true,
      "temporal_note": "in_force_from_year 1998, no amendment_events recorded; in force at 2026-04.",
      "verification_status": "proposed",
      "verifier_note": null
    },
    {
      "provision_id": "PROV-M009-004",
      "section_id": "21-1998/s39",
      "act_id": "21-1998",
      "formal_title": "Registration of Title Act No. 21 of 1998",
      "number_and_year": "No. 21 of 1998",
      "section": "39",
      "subsection": null,
      "relevant_excerpt": "No land parcel, title to which has been registered under this Act, or any interest therein shall be transferred or dealt with except in accordance with the provisions of this Act, and every disposition otherwise effected shall be void.",
      "why_relevant": "Supplies the sanction for the mandatory character of registration: a disposition of a registered parcel made otherwise than under the Act is void.",
      "applicable_to_matter_date": true,
      "temporal_note": "in_force_from_year 1998, no amendment_events recorded; in force at 2026-04.",
      "verification_status": "proposed",
      "verifier_note": null
    },
    {
      "provision_id": "PROV-M009-005",
      "section_id": "21-1998/s49",
      "act_id": "21-1998",
      "formal_title": "Registration of Title Act No. 21 of 1998",
      "number_and_year": "No. 21 of 1998",
      "section": "49",
      "subsection": null,
      "relevant_excerpt": "An instrument pertaining to land executed in accordance with the provisions of this Act shall take effect on registration, of such instrument under the provisions of this Act.",
      "why_relevant": "Registration is constitutive: until the gift instrument is registered it has no operative effect, which is the practical reason registration is mandatory.",
      "applicable_to_matter_date": true,
      "temporal_note": "in_force_from_year 1998, no amendment_events recorded; in force at 2026-04.",
      "verification_status": "proposed",
      "verifier_note": null
    },
    {
      "provision_id": "PROV-M009-006",
      "section_id": "21-1998/s44",
      "act_id": "21-1998",
      "formal_title": "Registration of Title Act No. 21 of 1998",
      "number_and_year": "No. 21 of 1998",
      "section": "44",
      "subsection": null,
      "relevant_excerpt": "A Notary Public attesting an instrument in terms of this Act shall- (a) satisfy himself regarding the identity of whosoever of the parties to the transaction and the witnesses, as are not known to him, by reference to their official identity cards or such other means as may reliably reveal their identity;",
      "why_relevant": "Section 45(1)(a) is triggered only by an instrument 'attested in terms of section 44', so this section is the condition precedent to the forwarding duty and identifies the notary as the Attestor on whom the duty falls.",
      "applicable_to_matter_date": true,
      "temporal_note": "in_force_from_year 1998, no amendment_events recorded; in force at 2026-04.",
      "verification_status": "proposed",
      "verifier_note": null
    },
    {
      "provision_id": "PROV-M009-007",
      "section_id": "21-1998/s75",
      "act_id": "21-1998",
      "formal_title": "Registration of Title Act No. 21 of 1998",
      "number_and_year": "No. 21 of 1998",
      "section": "75",
      "subsection": "definition of \"instrument\"",
      "relevant_excerpt": "means a document having the effect of conveying title to and interest in any land parcel in the prescribed form",
      "why_relevant": "The answer turns on the defined term 'instrument'; the deed of gift is an instrument only if it conveys title to a land parcel in the prescribed form, which is what brings sections 38, 39, 45 and 49 into play.",
      "applicable_to_matter_date": true,
      "temporal_note": "in_force_from_year 1998, no amendment_events recorded; in force at 2026-04. The corpus rendering of section 75 has lost the defined terms from the run of text, but the corpus records 'instrument' among the section's defined_terms.",
      "verification_status": "proposed",
      "verifier_note": "Confirm that the quoted words are the definition of 'instrument' and not of an adjacent term; the extracted body drops the term labels."
    },
    {
      "provision_id": "PROV-M009-008",
      "section_id": "21-1998/s43",
      "act_id": "21-1998",
      "formal_title": "Registration of Title Act No. 21 of 1998",
      "number_and_year": "No. 21 of 1998",
      "section": "43",
      "subsection": "2",
      "relevant_excerpt": "Instruments prepared under the provisions of subsection (1) shall be signed by the parties to the transaction and two witnesses and attested by a Notary Public",
      "why_relevant": "Explains why a notary is involved at all and why the gift deed had to be attested before the forwarding duty could arise.",
      "applicable_to_matter_date": true,
      "temporal_note": "in_force_from_year 1998, no amendment_events recorded; in force at 2026-04.",
      "verification_status": "proposed",